ratingScore,reviewTitle,reviewId,reviewUrl,reviewDescription,reviewImages,date,position,variant,totalCategoryRatings
5,Nice watch,R21MAZBWZ7BOWN,https://www.amazon.in/gp/customer-reviews/R21MAZBWZ7BOWN/ref=cm_cr_othr_d_rvw_ttl?ie=UTF8&ASIN=B0CR3C4GNW,Very nice watch,"['https://m.media-amazon.com/images/I/61ljTjwV1tL._SY88.jpg', 'https://m.media-amazon.com/images/I/71P98CNgNJL._SY88.jpg', 'https://m.media-amazon.com/images/I/71pbo9LvWZL._SY88.jpg']",2024-11-13,51,"Colour: Midnight Black, Style Name: Active",
4,mazfit GTS 4 Mini,R373I69OFLJH85,https://www.amazon.in/gp/customer-reviews/R373I69OFLJH85/ref=cm_cr_othr_d_rvw_ttl?ie=UTF8&ASIN=B0CR3C4GNW,"The media could not be loaded.
                
            
                
            
            
        
    
    








  
  
     mazfit GTS 4 MiniMaithili Rao . The watch is lightweight and comfortable to wear, and the strap is made of silicone, making it comfortable an ideal companion for fitness enthusiasts.  suitable for use during swimming or other water-based activities life of up to 14 days on a single charge, which is impressive considering its compact size. This means that you can wear it for extended periods without having to worry about recharging it frequently.The watch is compatible with both Android and iOS devices, and you can connect it to your smartphone using the Zepp app. The app offers a range of customization options and allows you to track your daily progress, set goals, and analyze your fitness data.Overall, the Amazfit GTS 4 Mini is an excellent choice for anyone looking for a compact and feature-packed smartwatch that can help them track their fitness and health. Its long battery life, stylish design, and range of features make it a great value for its price point.",['https://m.media-amazon.com/images/I/61ZAkV-HhGL._SY88.jpg'],2023-02-17,52,"Colour: Midnight Black, Style Name: GTS 4 Mini",
5,Worthy for the price bracket,ROHPKG4JF2Y5U,https://www.amazon.in/gp/customer-reviews/ROHPKG4JF2Y5U/ref=cm_cr_othr_d_rvw_ttl?ie=UTF8&ASIN=B0CR3C4GNW,"Watch justifies its price. no major bug found in this watch. But new buyers must check all the sensors of the watch are working, within the replacement period. Mine first watch was defected. Its Autobrightness function was not working and I noticed it after two days. But thanks to the Seller and Amazon that the watch was replaced with the new one with no hassle. Seller sends the new watch and the delivery boy gave me the new watch hand to hand after checking the defected watch is intact, without scratches and all that. steps tracking, sleep monitoring, is perfect. The inbuilt GPS seems to be dodgy if you try a walking workout in your 40 to 45 feet lawn, the distance calculation is inacurate if you walk to and fro between this short distance and take u turn after every 40 to 45 feet. in my case I walked around 8000 Steps in 1 hours and 12 minutes but the GPS shows that I covered only 5 kilometers distance whereas the Google Fit app I am using in my Mi 11x Smartphone shows that I have covered 6.8 kilometers. But The GPS tracker of the watch is completely accurate if you try it for longer distance, like walking by the roadside or walking or running on a longer track.  The Battery life of the watch is around 4 and a half days if you turn the heart rate monitoring interval to 30 minutes and are doing activity of around 1 and a half hour daily. in my case  these are the stats I am getting from this watch. inbuilt GPS tracker is really good but not be used to track running and walking activity in a smaller ground of around 40 to 45 feet.",[],2022-10-28,53,"Colour: Midnight Black, Style Name: GTS 4 Mini",
3,High priced watch,R3234ACFJS4PA6,https://www.amazon.in/gp/customer-reviews/R3234ACFJS4PA6/ref=cm_cr_othr_d_rvw_ttl?ie=UTF8&ASIN=B0CR3C4GNW,Writing this review after 1 year of usage.First of all the watch switches On and Off automatically very frequently need to fix this issue. And the system update is also not possible it is showing try again later. Overall  is a good smart watch. Battery backup is around 5 days with heavy usage.,[],2024-06-01,54,"Colour: Midnight Black, Style Name: GTS 4 Mini",
4,Good Watch with reliable data,RFSRW0XMX5GX0,https://www.amazon.in/gp/customer-reviews/RFSRW0XMX5GX0/ref=cm_cr_othr_d_rvw_ttl?ie=UTF8&ASIN=B0CR3C4GNW,It's a decent watch with ample data for a regular fitness data freaks. Distance and heart rate are fairly accurate when compared with other devices like odometers and electronic pulse monitors. It has managed to provide me with good and almost accurate counts when used for Jump Rope. Been almost a year now and I'm satisfied with the product.Only negative for me has been with the heart rate showing unusual reading when cycling. This doesn't happen regularly but does happen very happen. It becomes normal when I take it off for couple of seconds and then wear it back,[],2023-08-10,55,"Colour: Midnight Black, Style Name: GTS 4 Mini",
5,Best Watch,R3VOK5LH6PKVBO,https://www.amazon.in/gp/customer-reviews/R3VOK5LH6PKVBO/ref=cm_cr_othr_d_rvw_ttl?ie=UTF8&ASIN=B0CR3C4GNW,"I like Amazfit watch. Wery good product. Sound quality, Display quality, Brightness, Sleep tracking, Notification, Charging ability wery good.",[],2024-10-09,56,"Colour: Midnight Black, Style Name: Active",
5,READ FULL REVIEW!!!!  PROS and CONS,R2HL80J9SBJNSQ,https://www.amazon.in/gp/customer-reviews/R2HL80J9SBJNSQ/ref=cm_cr_othr_d_rvw_ttl?ie=UTF8&ASIN=B0CR3C4GNW,"Review written on:29/07/22Updated last on: 27/03/23--Purchased this watch at first sale price of 6999. Writing this review after 2 days of use.The watch is absolutely premium. The smartwatch is very light and comfortable as mentioned 19gms only. The watch strap is very soft,made of premium quality silicon and has interpolation system hence gives a secure fit but the buckle is made of plastic instead of metal.--It has 2.5d curved and completely flat display, half metal body and button which gives it a premium look. The display is anti fingerprint and is scratch resistant.The watch will be suitable only on small and moderate sizes of wrists otherwise would look of small size.--The watch has squarish 1.65 inch Amoled display with Aod support and 309ppi so all texts are really crisp and readable.The bezels are equal on all sides and completely invisible with black watchface. Also you can set your own watchface under the settings of customisable background in watchface store in zepp app.--It comes with new Zepp OS 1.0 which is well optimised and the animations and details dont make it a boring fitness watch.The watch has ambient light sensor which responds well and screen is visible even in harsh sunlight. It has 5 satellites connection which locks position outdoors within few seconds.The watch has a rotor motor which gives good haptic feedback. It also has built in alexa which can answer simple questions via text and set alarms, reminders,timers.--The watch has 50 watchfaces only which are extremely less at this price point and only 7-8 of them look good. Watchfaces synchronize within 10seconds.--There is 24/7 heart rate,blood oxygen and stress monitoring. The watch gives really accurate measurements and is quite dependable for health readings,this is probably due to the latest biotracker-ppg 3.0 sensor which is being used in this watch. (Note:Sp02 works only when you wear the watch 2cm upwards from the wrist). It also has sleep breathing quality measurement. The sleep data too is very accurate and gives data for light sleep, deep sleep, REM,awake time in graph and detailed format.--The watch has 120+ sports modes, gives very detailed health data,graphs, auto detects sports modes and has virtual pacer, cadence assistant,everything you would ever need for.You will be able to view all the data in watch itself(workout map,graphs,sleep data,settings). It also has training efficiency which tells you training load, vo2 max and recovery time.--The best part are the installable apps from the appstore in zepp app like maps(not google maps) calculator(not scientific calculator), bmi, watch storage space, sos flashlight and water time reminder and many more. It has all the basic features like the alarm,calendar(syncs to phone's calender),to-dos,sun and moon,compass,music controller,world clock,stopwatch,countdown,breathe,find my phone,pomodoro timer,camera remote. It comes with new smart alarm feature which wakes you up during light sleep. It has reply to call notifications but misses out on the reply to social media messages.--It has 200mb of storage space of which 100mb is used by system itself and other 100mb is free for installing apps and watchfaces(no music storage available). For incoming messages it has support for chosen emojis only not all of them, also it does not have support for hindi text messages. It also has password lock from 0-9 for privacy. It will have new features over time and new apps to install in app store which is good.--Finally the watch charges in 2hrs and drops 5% battery everyday on normal usage, about 8% with aod on, 13% on moderate usage and 20% on heavy usage of gps,aod on,24/7 health tracking and other apps usage(additional 3% for tracking sleep data).[  ] PROS:--Feature packed smartwatch--Stylish and Elegant design--4 colour straps available--Complete health tracking--Bio ppg 3.0 sensor for accurate measurements--Built in gps with 5 sattelite connections--120+ sports modes--Auto detects sports modes--Interactive and colourful Zepp OS 1.0--Amoled with Aod--Alexa--Auto brightness--Training efficiency--5 ATM waterproof--Good battery life--Installable apps--New Smart alarm feature--Interpolation system--Password privacy--Quick reply to call notifications--Lot of third party straps available(eg.leather strap)--No need to use smartphone for viewing health and activity data, can be viewed from watch itself.[  ] CONS:--Could be at a lesser price of 6999(Original price-7999)--Very Less watchfaces--Screen freezes sometimes on heavy usage--Slight lag in UI--Very short charging cable length about 30cm--No barometric sensor--No music storage--Plastic buckle--Missing breath per minute feature available in more premium amazfit watchesIMPROVEMENTS:--Less Emoji support--No quick reply to social media messages(eg. WhatsApp)FINAL DECISION:If you are looking for premium fitness watch with all health sensors ,accuracy, elegant and formal looking watch, amazing user interface with possible future software upgrades and also if you are not a bluetooth calling personthen buy the Gts 4 Mini during the sale with some 10% discount with cards offer.Don't change your decision and go looking for other useless bluetooth calling, in built games watches in this price segment (Fireb****, Noi**). This smartwatch is really good, you won't regret purchasing this one.Experience after 1 Year:Working Great. Everything is working including GPS, health tracking and other features mentioned in review.Update: Do not buy GTR Mini, it's not worth the price tag of 10,999/-. Gts 4 Mini is much better than the GTR Mini.Give Like 👍 if this helps.","['https://m.media-amazon.com/images/I/715rj70xVuL._SY88.jpg', 'https://m.media-amazon.com/images/I/71BmaKppXGL._SY88.jpg', 'https://m.media-amazon.com/images/I/818ZDtUfdvL._SY88.jpg']",2022-07-20,9,"Colour: Midnight Black, Style Name: GTS 4 Mini",
4,Wrist Band,R12TFIHRRLEHDF,https://www.amazon.in/gp/customer-reviews/R12TFIHRRLEHDF/ref=cm_cr_othr_d_rvw_ttl?ie=UTF8&ASIN=B0CR3C4GNW,"The wrist band is very thin, otherwise the product is value for money, calibration of fitness level, connectivity & notification functionality are satisfactory",[],2024-12-04,10,"Colour: Midnight Black, Style Name: Active",
4,Good but the not scratch proof.,R2GQFMFVH3FJ2A,https://www.amazon.in/gp/customer-reviews/R2GQFMFVH3FJ2A/ref=cm_cr_othr_d_rvw_ttl?ie=UTF8&ASIN=B0CR3C4GNW,"I thought the glass would be scratchproof but it is not, rather minor grazing will leave permanent scratches—otherwise a very good product. Good Voice output when receiving calls, sensors, and GPS are pretty sensitive. The Zepp app is also very user-friendly.",[],2024-11-19,11,"Colour: Midnight Black, Style Name: Active",
3,Wanted to give 5 stars but... 👇,R3H97Z8NUHAK3R,https://www.amazon.in/gp/customer-reviews/R3H97Z8NUHAK3R/ref=cm_cr_othr_d_rvw_ttl?ie=UTF8&ASIN=B0CR3C4GNW,"The media could not be loaded.
                
            
                
            
            
        
    
    








  
  
     Got it under 5k during festival,, packed with features pretty accurate sensors. Better than any other watches in this price segment.1)But the main problem started few days ago. After a month of use it started tracking inaccurate sleep data. I don't know what's the issue because everything working fine except this. Seems Sleep tracking ability of this watch has gone. 2)Another problem is sometimes doesn't work the raise to wake feature.3)When charging it, sometimes it doesn't fully charge. Sometimes goes to 90%-95% and stops charging.4) The biggest drawback is no after sales support from amazefit..",[],2024-11-07,12,"Colour: Midnight Black, Style Name: Active",
4,It good,R2WWG8440WVJ39,https://www.amazon.in/gp/customer-reviews/R2WWG8440WVJ39/ref=cm_cr_othr_d_rvw_ttl?ie=UTF8&ASIN=B0CR3C4GNW,Look good,[],2024-11-11,13,"Colour: Lavender Purple, Style Name: Active",
5,In build GPS is really working fantastic.,R91C94AM4314E,https://www.amazon.in/gp/customer-reviews/R91C94AM4314E/ref=cm_cr_othr_d_rvw_ttl?ie=UTF8&ASIN=B0CR3C4GNW,Excellent product from Amazefit.,[],2025-01-24,14,"Colour: Midnight Black, Style Name: Active",
4,Value for money,R3M45GUCI98UQ0,https://www.amazon.in/gp/customer-reviews/R3M45GUCI98UQ0/ref=cm_cr_othr_d_rvw_ttl?ie=UTF8&ASIN=B0CR3C4GNW,"Accurate steps count , good for users who track their fitness",[],2024-11-05,15,"Colour: Midnight Black, Style Name: Active",
5,Sports fitness tracker,R3BGWNK5CY7IFR,https://www.amazon.in/gp/customer-reviews/R3BGWNK5CY7IFR/ref=cm_cr_othr_d_rvw_ttl?ie=UTF8&ASIN=B0CR3C4GNW,Amazing watch . Perfect sports tracker.,[],2025-01-19,16,"Colour: Midnight Black, Style Name: Active",
5,Good,R18BR6UL8W2N5Z,https://www.amazon.in/gp/customer-reviews/R18BR6UL8W2N5Z/ref=cm_cr_othr_d_rvw_ttl?ie=UTF8&ASIN=B0CR3C4GNW,Nice,[],2024-10-25,65,,
4,neither Premium nor accurate,R1CEBLGE7W7Z24,https://www.amazon.in/gp/customer-reviews/R1CEBLGE7W7Z24/ref=cm_cr_othr_d_rvw_ttl?ie=UTF8&ASIN=B0CR3C4GNW,"Purchased this watch on the launch day itself. I was planning for GTS mini 2 before this but when I saw this i went this because it was the latest offering from the company.Pros:1. Display is crisp and AMOLED color reproduction is good.2. Feels sturdy, good build quality.3. Battery life is good can last 10 days easily.4. Touch feels smooth and zepp os doesn't lag.Cons:1. This was costs 8K yet it looks kinda chip and looks similar to any 2k-3k watch.2. Bezels are quite thick for a watch in 2022.3. Strap quality felt good earlier but now feels uncomfortable.4. Watch faces are limited and most of them are not that great.Conclusion:Comparing to GTS mini 2 this watch doesn't offer anything that can justify extra 2k rupees you spend.Will update the review after a few month of usage.",['https://m.media-amazon.com/images/I/71qP0wUCB1L._SY88.jpg'],2022-07-20,66,"Colour: Midnight Black, Style Name: GTS 4 Mini",
4,Worth the price,R3BWVBVWB9H5WN,https://www.amazon.in/gp/customer-reviews/R3BWVBVWB9H5WN/ref=cm_cr_othr_d_rvw_ttl?ie=UTF8&ASIN=B0CR3C4GNW,"Pretty useful tracker. Works perfectly with my iPhone.You can connect WhatsApp, emails etc.It has speakers but no mic but makes sense according to the price.Pretty smooth operation, people sometimes mistake it for apple watch lol. 😂",['https://m.media-amazon.com/images/I/61Th0gQKhVL._SY88.jpg'],2024-03-10,67,,
5,Bhut achha,R3BD6XPPC75TX8,https://www.amazon.in/gp/customer-reviews/R3BD6XPPC75TX8/ref=cm_cr_othr_d_rvw_ttl?ie=UTF8&ASIN=B0CR3C4GNW,Achhi hai,[],2024-10-20,68,"Colour: Midnight Black, Style Name: Active",
5,Nice and beautiful,RRLDB6BIVWFJ2,https://www.amazon.in/gp/customer-reviews/RRLDB6BIVWFJ2/ref=cm_cr_othr_d_rvw_ttl?ie=UTF8&ASIN=B0CR3C4GNW,Gr8 👍 amazfit active good quality,[],2024-10-17,69,"Colour: Lavender Purple, Style Name: Active",
5,Very good,R1CJ2KR3VPKT9W,https://www.amazon.in/gp/customer-reviews/R1CJ2KR3VPKT9W/ref=cm_cr_othr_d_rvw_ttl?ie=UTF8&ASIN=B0CR3C4GNW,"Money's worth.  Good product, meets all specifications perfectly.",[],2024-10-07,70,"Colour: Petal Pink, Style Name: Active",
5,Nice watch 👍,R1FPUFQEMRSIAD,https://www.amazon.in/gp/customer-reviews/R1FPUFQEMRSIAD/ref=cm_cr_othr_d_rvw_ttl?ie=UTF8&ASIN=B0CR3C4GNW,,['https://m.media-amazon.com/images/I/61mOah1d6+L._SY88.jpg'],2024-10-21,71,"Colour: Petal Pink, Style Name: Active",
1,Unsafe and dangerous,RQC1FNEWLI993,https://www.amazon.in/gp/customer-reviews/RQC1FNEWLI993/ref=cm_cr_othr_d_rvw_ttl?ie=UTF8&ASIN=B0CR3C4GNW,I bought this watch and the back part popped off after vibrating continuously. Looks like cheap quality product and would not recommend amazefit brand. Go for rather cheaper brand but not amazefit. This is a very serious issue.,['https://m.media-amazon.com/images/I/61dNOCdZ91L._SY88.jpg'],2025-01-11,72,"Colour: Midnight Black, Style Name: Active",
5,Worth it,R9QJVL9FS1HQL,https://www.amazon.in/gp/customer-reviews/R9QJVL9FS1HQL/ref=cm_cr_othr_d_rvw_ttl?ie=UTF8&ASIN=B0CR3C4GNW,Amazfit Active sports a simple and minimalistic design. The compact and lightweight smartwatch features a square dial. The smartwatch weighs around 24 grams and it has an aluminium frame which makes it look premium. The right side of the smartwatch houses the power button which also allows you to access the menu and perform some other actions. The smartwatch comes with Bluetooth calling support and the microphone is placed next to the power button. The left side of the wearable has the speaker grill. The rear of the smartwatch consists of a plastic case which accommodates all the sensors and the magnetic charging pins. The lightweight Amazfit Active smartwatch comes with soft and skin-friendly silicone straps. The straps are quite comfortable to wear and you will not feel any irritation on your skin even after sweating. If you want you can also interchange the straps. The waterproof design of the smartwatch also allows the users to use it while swimming.This is the right watch which was you looking over a timeRecently i baught this watch and I'll tell you what amazing Accuracy 💯Heart rate 💯Step count 💯Call quality 💯Strap quality 💯Zepp app 💯GPS 💯Everything is perfect just go for it,['https://m.media-amazon.com/images/I/61yLbwC3CjL._SY88.jpg'],2024-03-20,33,"Colour: Midnight Black, Style Name: Active",
3,Feature are good but build quality is low,RBMRSUNNEGTQD,https://www.amazon.in/gp/customer-reviews/RBMRSUNNEGTQD/ref=cm_cr_othr_d_rvw_ttl?ie=UTF8&ASIN=B0CR3C4GNW,I was using Amazfit GTS past & build quality is better. This one is not up to mark,[],2024-09-30,34,"Colour: Midnight Black, Style Name: Active",
4,It's a good fitness tracking watch.,R3UR9N5F3J22YJ,https://www.amazon.in/gp/customer-reviews/R3UR9N5F3J22YJ/ref=cm_cr_othr_d_rvw_ttl?ie=UTF8&ASIN=B0CR3C4GNW,"A good fitness tracking watch. Overall it does the job. Zepp app is also easy to use.Pros:- Battery life - with all alerts and notifications on I'm getting around 10days of battery life.- GPS - Having GPS feature at this price is awesome and it connects fast and shows accurate data like speed, pace, heart rate, eta for outdoor workouts.- 5ATM Water proof - Only a handful of smartwatches have 5ATM rating at this price range and there are plenty of water sports available to track including swimming.- AMOLED Display - The Amoled display on this watch is crisp and the blacks are deep or no led lot at all. Very clear display and Colors are just fine.- Light on wrist - Another advantage with this watch is it's very light and you don't feel heavy on your wrist. It's very light to wear even at nights.Cons:- Steps tracking is not that accurate- Sleep tracking is not accurate- At times connecting watch to Zepp app is very annoying. Data synching is very slow. Over all connectivity itself is slow and very less watch face options.- Wake on wrist rise feature is good but display will always turns while riding scooter or bike.- Spo2, Heart rate, stress values are not accurate so these values are just for reference and do not depend on them.",[],2022-08-30,35,"Colour: Midnight Black, Style Name: GTS 4 Mini",
5,Awesome I got this 4700 in this sale and love it,R2QRRTCADTM0XF,https://www.amazon.in/gp/customer-reviews/R2QRRTCADTM0XF/ref=cm_cr_othr_d_rvw_ttl?ie=UTF8&ASIN=B0CR3C4GNW,Battry is around 6 to 8 days for moderate usage without 24 hours heart monitor and with calls bluetooth. Normal around 14 days . ❤️,['https://m.media-amazon.com/images/I/71UJJcy4WUL._SY88.jpg'],2024-10-31,36,"Colour: Midnight Black, Style Name: Active",
5,Amazing watch,R2J0K0IP27Y2WH,https://www.amazon.in/gp/customer-reviews/R2J0K0IP27Y2WH/ref=cm_cr_othr_d_rvw_ttl?ie=UTF8&ASIN=B0CR3C4GNW,I bought it at around 6k.. totally worth it at this price . I like it ..,['https://m.media-amazon.com/images/I/617kA7D49kL._SY88.jpg'],2024-11-09,37,"Colour: Midnight Black, Style Name: Active",
3,Good not great,R2XZIGZSN2PHQY,https://www.amazon.in/gp/customer-reviews/R2XZIGZSN2PHQY/ref=cm_cr_othr_d_rvw_ttl?ie=UTF8&ASIN=B0CR3C4GNW,"I bought this product for my mom and myself.Quality: 4 ⭐ tracking is great, build quality is also good UI is great.Features: 3 ⭐ it has some good features when it comes to Amazon integration however overall at this price range there are so many products which are providing much better featuresValue: 3 ⭐ as mentioned at this price range it is just a fitness tracker nothing more, however the quality is good so 3 for that",[],2024-05-15,38,,
2,Workout modes steps not accurate,RW4U3ZKHEXSZ,https://www.amazon.in/gp/customer-reviews/RW4U3ZKHEXSZ/ref=cm_cr_othr_d_rvw_ttl?ie=UTF8&ASIN=B0CR3C4GNW,"Whenever I use workout modes like dance ,  treadmill etc. the step count and calorie  is way less  than what I see in other watches. Only while choosing walking mode it calculates steps correctly. Waste of using other sports modes.",[],2024-11-23,39,"Colour: Midnight Black, Style Name: Active",
1,Pathetic Customer service,R2CL77VFMW8U1K,https://www.amazon.in/gp/customer-reviews/R2CL77VFMW8U1K/ref=cm_cr_othr_d_rvw_ttl?ie=UTF8&ASIN=B0CR3C4GNW,"I purchased it from.Amazon but calls and messages were not coming to the watch.Further watch was paired yet it is getting frequently disconnected from Bluetooth. Approached Amazfit customer service but they were non-responsive upon call. Through chat they become ready to get it repaired though watch is ordered only one day back and delivered on the day of complaint and as per description at Amazon, it is to be replaced. When I shown them, they become unresponsive. Amazon customer service too refused to help rather advised to contact service center. Really very pathetic customer service of Amazefit and the product is also not worth .",[],2025-01-28,40,"Colour: Midnight Black, Style Name: Active",
5,Just go for it without any doubt,R2T3QK1HKWQ2F8,https://www.amazon.in/gp/customer-reviews/R2T3QK1HKWQ2F8/ref=cm_cr_othr_d_rvw_ttl?ie=UTF8&ASIN=B0CR3C4GNW,i am using amazfit band but recently switch on this watch. its amazing. first of all talk about the battery life then its perfect. initially my watch not able to track sleep properly so i called to their customer care and reset my watch then its perfectly tracking everything from sleep to steps. Bluetooth calling feature working perfectly on this watch with long battery life. better than apple or any samsung watches. go for it.,[],2024-10-22,25,"Colour: Midnight Black, Style Name: Active",
3,Not worth 12k,R2NJ6IYWILYVAC,https://www.amazon.in/gp/customer-reviews/R2NJ6IYWILYVAC/ref=cm_cr_othr_d_rvw_ttl?ie=UTF8&ASIN=B0CR3C4GNW,Bought the watch for 12k and in terms of built and design it’s slightly better than the market but nothing vastly different. It is light weight which is great.In terms of features it’s same as a 4K smartwatch. Also the UI is pretty basic and average.,[],2024-09-21,26,"Colour: Lavender Purple, Style Name: Active",
2,Worst Amazfit watch,R1ZB3SRHTJ7PP2,https://www.amazon.in/gp/customer-reviews/R1ZB3SRHTJ7PP2/ref=cm_cr_othr_d_rvw_ttl?ie=UTF8&ASIN=B0CR3C4GNW,"The media could not be loaded.
                
            
                
            
            
        
    
    








  
  
     I'm writing this review after using 1 months and come to know that this is a Worst Amazfit watch so far I have used. I was using amazfit GTS 2 mini and it was far better than this.i am very much disappointed with this watch on the performance.Cons;1.Sleep data is not accurate and it's not record properly. Useless to wear in night.2.Readiness is not accurate due to its not record the sleep data accurately.3. Zepp Coach is useless and it's not record the accurate once you stop the workout in mid between then you can't resume.4. Zepp Aura is useless to subscribe due to its not read sleep data accurately.5. Heart rate has inaccurate reading.Pros: nothing and looks good on hand.",[],2024-11-15,27,"Colour: Midnight Black, Style Name: Active",
4,For workout great watch,RGXVYIYLENE13,https://www.amazon.in/gp/customer-reviews/RGXVYIYLENE13/ref=cm_cr_othr_d_rvw_ttl?ie=UTF8&ASIN=B0CR3C4GNW,Battery: 3-4 dayOn always in disp 24 hours.Heart rate steps sleep all accurate.Water proof complete.Felt watch is small for me in my hand.,['https://m.media-amazon.com/images/I/61mNYykvFxL._SY88.jpg'],2024-07-31,28,"Colour: Midnight Black, Style Name: Active",
5,Sleek look,R1WI14MMPWY80C,https://www.amazon.in/gp/customer-reviews/R1WI14MMPWY80C/ref=cm_cr_othr_d_rvw_ttl?ie=UTF8&ASIN=B0CR3C4GNW,Product looks premium. Yet to explore features.,[],2024-12-05,29,"Colour: Midnight Black, Style Name: Active",
