ratingScore,reviewTitle,reviewId,reviewUrl,reviewDescription,reviewImages,date,position,variant,totalCategoryRatings
5,One of a kind for sure,R136JKZX7QIA6G,https://www.amazon.in/gp/customer-reviews/R136JKZX7QIA6G/ref=cm_cr_othr_d_rvw_ttl?ie=UTF8&ASIN=B0CR3C4GNW,"Was this the smart watch one was waiting for, at this price point, over the last 2 years, when the smart watch market started to boom in India? Probably yes...Having tried a number of watches over the last 2 years, I was convinced, apart from Apple, Samsung and Garmin( although a different segment) , none of the others had a clue about what a specific group of target audience needed. They were all launching watches left, right and center with very little commitment to fitness. They were good looking watches, and they lured the masses. For me and maybe a few more, what is of prime importance in a smart watch? Here it is.1. Fitness accuracy and measurements of vitals2 Battery3 App, reports, integration with 3rd party fitness apps4 Display5 watch facesThe rest of the stuff doesn't really matter if these bases are covered. Unfortunately people are busy talking about looks and straps and missing out on the crucial features.One of the many watches I bought as a fitness enthusiastic guy was Titan traveler. Was good enough until a software update and it crashed. It still doesnt open. And i paid a bomb for it. They say they're working on it.Now this watch is amazing. Firstly, small display and very light and comfortable.Brilliant, reports, integration with major fitness apps, a zepp coach that designs programs based in your preference, super accurate, crisp AMOLED display , great battery life. I have all parameters turned on and it would run for a week, easily. Some great apps could be installed from the market, very very good watch faces, great customization. Amazfit knows the business. I used a amazfit Bip 5 before this and was a very good watch. Has a calendar that syns with google, readiness for training analysis. A pocket dynamo. Sunrise sunset app along with detailed weather for travellers. So I could go on and on.Ah yes, you can store music. Plenty of storage for music, apps and watch faces. There is a utility called watch storage on the store you can download. Shows you space available for each category. And the sound is crystal clear. Calls and music.If you have a budget, just go for it blindly. Trust me",[],2024-02-11,1,"Colour: Midnight Black, Style Name: Active",
4,"Value for Money, Decent Tracker, Could Do with Better Screen Brightness!",RQFSKYTW5ZVR3,https://www.amazon.in/gp/customer-reviews/RQFSKYTW5ZVR3/ref=cm_cr_othr_d_rvw_ttl?ie=UTF8&ASIN=B0CR3C4GNW,"Good things:1) Excellent and accurate step tracker for my routine workouts (outdoor, walking/running, badminton, cricket, tennis). Yet to try this in swimming though.2) Quality of belt or strap is good, no discomfort wearing for long hours or when there is sweating.3) Battery life holds up well - I have phone notifications disabled, getting 10+days on a full charge.4) Screen quality and touch response overall is quite good. The only issue I face is visibility in bright sunlight is a letdown.A couple of shortcomings:1) Day-time visibility -> Visibility in bright sunlight is a let-down. Could have been better.2) GPS connection prior to starting an outdoor workout (running/sports) often takes 15-30 seconds.So overall a good buy from my side, rating it a 4*!",[],2024-12-20,2,"Colour: Petal Pink, Style Name: Active",
5,Fantastic Smartwatch for the Price,RHM08MP9T40BD,https://www.amazon.in/gp/customer-reviews/RHM08MP9T40BD/ref=cm_cr_othr_d_rvw_ttl?ie=UTF8&ASIN=B0CR3C4GNW,"The media could not be loaded.
                
            
                
            
            
        
    
    








  
  
     I recently purchased the Amazfit Watch, and I must say it has exceeded my expectations in every way. Here's why I think it deserves a solid five-star review:1. Affordable Excellence: This smartwatch offers features comparable to much more expensive brands, making it an excellent value for money.2. Stylish Design: The Amazfit Watch boasts a sleek and modern design that looks great on your wrist. It's perfect for both casual and formal occasions.3. Impressive Battery Life: One of the standout features of this watch is its incredible battery life. I can easily go a week or more between charges, even with regular use.4. Accurate Fitness Tracking: The fitness tracking capabilities are on point. It accurately tracks my steps, heart rate, sleep patterns, and more. The accompanying app provides detailed insights into my health and fitness progress.5. Variety of Sports Modes: Whether you're into running, cycling, swimming, or other sports, this watch has a wide range of sports modes to track your activities effectively.6. Smart Notifications: It seamlessly connects to my smartphone, allowing me to receive notifications for calls, messages, and apps right on my wrist. It's incredibly convenient when I can't reach for my phone.7. Durable Build: The watch is built to last. It's water-resistant, so I can wear it in the rain or while swimming without worry. The screen is scratch-resistant, which is a big plus.8. Comfortable Fit: The watch feels comfortable on the wrist, even during long workouts or all-day wear. The strap is easily adjustable to fit any wrist size.9. User-Friendly Interface: Navigating through the watch's menus and features is intuitive, thanks to the responsive touchscreen and user-friendly interface.In conclusion, the Amazfit Watch offers unbeatable value for its price. It combines style, functionality, and durability into one impressive package. I highly recommend it to anyone in the market for a reliable and feature-packed smartwatch. This watch has truly made my life more convenient and healthier, and I couldn't be happier with my purchase!",[],2023-10-08,3,,
1,DO NOT BUY,R1P6H4HANKKZM,https://www.amazon.in/gp/customer-reviews/R1P6H4HANKKZM/ref=cm_cr_othr_d_rvw_ttl?ie=UTF8&ASIN=B0CR3C4GNW,"WARNINGDo not buy Amazfit products. When I bought it, after opening the box, and I tried to charge  the watch and it wouldn't fit the charger. Since my friend had the same watch and charger, I borrowed that charger, but that charger wouldn't fit either. It just kept on slipping away from the watch. Hence found that it was not the chargers' problem, but, the watches. Contacted Amazon for support. And there was no use other than them telling me that it is a non returnable and non refundable product and offered to give the customer care number of Amazfit. (Note-  Be weary of buying  ANY electronic gadgets from Amazon from now on because, as per their latest policy, they will not accept returns on most items. And put the entire blame on the seller and will ask the customer to contact the seller and solve it with them. Expect absolutely zero help from Amazon). Mind you, I had contacted Amazon customer care immediately after receiving the product and opening it and finding that it was damaged.Contacted Amazfit service centre and they are a big joke. They have just one person attending the call. It's very hard to get to talk to a human at their customer service centre. And even when you tried to make your case and explain to them your frustration, the insensitive guy on the other end will give you some inconclusive answer and disconnect the call. YES. THEY DISCONNECT YOUR CALL IN THE MIDDLE OF A CONVERSATION. You have to be very persistent and invest a lot of your time following up to get your issue addressed. Now since this was a brand new product,. I demanded a fresh replacement. So finally, they sent a Google form to fill and register your complaint. BUT, the Google form will not work!!??!!!!- it cannot be submitted due to some ""complication"". Hence, you will have to fill the form and take screenshots of it and send it to them. Then, you have to video record the issue of the product, pack that item and courier to them. Clear photographs and videos of packing are also needed. Plus, you have to write the issue in a piece of paper and stick it on the packed box.Thankfully, they arranged for the item pick up, but then started the waiting. They will refuse to even give a customer complaint number. After 3 whole weeks of continuous calling and following up and repeating the issue to the same customer service guy again and again and again, i demanded a brand new unopened replacement , but, according to the customer service policy, they have to repair the item if it is repairable and only if it is unrepairable, will they give you a brand new one. After fighting with the guy and making multiple calls again, today I received a ""repaired"" watch in a torn up box and not a brand new one. Hence, whoever is planning to buy any Amazfit products, please please consider this a warning and not by ANYTHING from them. Considering the way they treat their customers, I am sure this brand will self distruct very soon. Nobody should get to feel trapped and cheated by this brand.",[],2024-11-17,4,"Colour: Midnight Black, Style Name: Active",
5,A Perfect watch to Buy,R2MPW1E8055CEE,https://www.amazon.in/gp/customer-reviews/R2MPW1E8055CEE/ref=cm_cr_othr_d_rvw_ttl?ie=UTF8&ASIN=B0CR3C4GNW,"I have received this watch 2 week ago.I am using Amazfit Brand smartwatch watch from last 6 years. 1st was Amazfit bip then Amazfit GTS 2 mini, both experience was awesome1. Display is awesome, clear & sharp.2. Battery on normal usage run 10 days. It may be depends on usage3. Build Quality could be better, due to its silver colour. It is not looks premium. If it was totally black metal then it becomes awesome4. Zepp application is so smooth.5. There is a button for some function. It will be looks cheap.",[],2024-12-13,5,"Colour: Midnight Black, Style Name: Active",
3,Not as good as expected.,R31K4U0KYFWOD2,https://www.amazon.in/gp/customer-reviews/R31K4U0KYFWOD2/ref=cm_cr_othr_d_rvw_ttl?ie=UTF8&ASIN=B0CR3C4GNW,First of all its a feature packed and good looking smartwatch. I am using this watch for 4 days. But its not well optimized. Raise to wake is slow and sometimes doesn't even works. Next thing you can do is to use the button to wake the screen. If you press the button when screen is off ot will wake the screen and open app list directly so you have to press twice everytime. If you use flashlight feature sometimes it goes off by itself and only turn on in raise to wake. Battery drain is around 10 to 12 percentage for me.Pros- Accurate sensors- Good looking and light weight.- Really good app- Lot of features- Most of the settings i can use from the watch itself without opening the app.- Weather feature can be used without location permission.Cons- Os is not optimised for the watch- Less number of watch faces- Only default face can be customised- Have some annoying bugs.- Strap style is little bit hard to get use to (I still struggle with ot everyday.),[],2022-07-23,6,"Colour: Midnight Black, Style Name: GTS 4 Mini",
4,"Good Watch, Packaging could be better",R15QY0HHLCEFOC,https://www.amazon.in/gp/customer-reviews/R15QY0HHLCEFOC/ref=cm_cr_othr_d_rvw_ttl?ie=UTF8&ASIN=B0CR3C4GNW,"The Box that watch came in was in a second hand condition. Apart from that its a good purchase in this process range and has got sufficient features for someone who doesn’t want Laptop but instead only a Smartwatch on their wrists.Display Quality is good. Battery is working fine , Is still at same percentage after 6 hours of usage.",['https://m.media-amazon.com/images/I/71mI-0In2iL._SY88.jpg'],2024-10-22,7,"Colour: Midnight Black, Style Name: Active",
5,Nothing gets better than this in this budget!,R1OZRFDOYHKJZE,https://www.amazon.in/gp/customer-reviews/R1OZRFDOYHKJZE/ref=cm_cr_othr_d_rvw_ttl?ie=UTF8&ASIN=B0CR3C4GNW,"It's the best real smart watch experience in limited budget. It has so many features that even after 2 weeks I have still not explored it fully. The zepp app store expands it's capabilities immensely. The health tracking is seemless. I have actually seen significant impor event in my sleep quality ever since I started using the ""readiness"" mode and realised that next day goes so well if sleep quality is good.It's a very practical and useful feature. Gps is also very accurate.I think it is THE best smartwatch if you are getting in season offer.",[],2024-10-09,8,"Colour: Midnight Black, Style Name: Active",
5,Amazfit watch,R1MOCMNGV5N8C0,https://www.amazon.in/gp/customer-reviews/R1MOCMNGV5N8C0/ref=cm_cr_othr_d_rvw_ttl?ie=UTF8&ASIN=B0CR3C4GNW,Very nice watch shapes are very good looks beautiful on hand and all features in the watch are very good and accurate,[],2024-10-28,41,"Colour: Midnight Black, Style Name: Active",
4,Nice finess watch with World time,R1MN1H2Y1C2ZJ1,https://www.amazon.in/gp/customer-reviews/R1MN1H2Y1C2ZJ1/ref=cm_cr_othr_d_rvw_ttl?ie=UTF8&ASIN=B0CR3C4GNW,"The media could not be loaded.
                
            
                
            
            
        
    
    








  
  
     I bought this just for 2 reasons 1. It supports world time (for my overseas traveling) 2. It has Inbuilt GPSWorld time: World time of different cities can be selected. Altough world time  is not available on home screen but it can be configured to display by long pressing crown button or  by left swapping home screen.Display is of good quality very rich in colour and appearance. Weight of the watch is very less.One drawback: supplied strap is small a bit.If budget permits, better to go for GTS 4, in place of GTS 4 mini.","['https://m.media-amazon.com/images/I/611N0N9bbML._SY88.jpg', 'https://m.media-amazon.com/images/I/61A5egiPj7L._SY88.jpg', 'https://m.media-amazon.com/images/I/61hI5-seSeL._SY88.jpg']",2023-11-19,42,"Colour: Midnight Black, Style Name: GTS 4 Mini",
5,Amazfit is Amazing,R1O1IH48QSE65W,https://www.amazon.in/gp/customer-reviews/R1O1IH48QSE65W/ref=cm_cr_othr_d_rvw_ttl?ie=UTF8&ASIN=B0CR3C4GNW,Starting from build quality to display of this watch and the ease of to use this watch with every good battery performance. A very light weight watch. Amazfit application has also very good interface.,[],2024-10-04,43,"Colour: Midnight Black, Style Name: Active",
5,Great Functionality,RF6YBGFZN7SBW,https://www.amazon.in/gp/customer-reviews/RF6YBGFZN7SBW/ref=cm_cr_othr_d_rvw_ttl?ie=UTF8&ASIN=B0CR3C4GNW,"Good way to track your exercises, heart rate, stress level, blood oxygen, and many more. Love the comprehensive dashboard generated in the app as well.","['https://m.media-amazon.com/images/I/71JhpMRsGzL._SY88.jpg', 'https://m.media-amazon.com/images/I/71eXW9A+CzL._SY88.jpg', 'https://m.media-amazon.com/images/I/818AjU99L6L._SY88.jpg']",2024-10-22,44,"Colour: Midnight Black, Style Name: Active",
5,Stylish. I like the colour,R13MVDGOOXMXDP,https://www.amazon.in/gp/customer-reviews/R13MVDGOOXMXDP/ref=cm_cr_othr_d_rvw_ttl?ie=UTF8&ASIN=B0CR3C4GNW,"Looks good feels good , there is option of of recieving calls and can also speak through the watch if necessary so thats good . Easy to use looks very stylish. My iphone connects to it through Zepp app. Im now fully sure how it works. Will update later.","['https://m.media-amazon.com/images/I/715XFT51YZL._SY88.jpg', 'https://m.media-amazon.com/images/I/71mO8DsQAIL._SY88.jpg', 'https://m.media-amazon.com/images/I/81BaCoIGdBL._SY88.jpg']",2024-09-16,45,"Colour: Lavender Purple, Style Name: Active",
5,Best Smart Watch if anyone want proper health reading compare to Other Smart watches,R252KHK06LKNLQ,https://www.amazon.in/gp/customer-reviews/R252KHK06LKNLQ/ref=cm_cr_othr_d_rvw_ttl?ie=UTF8&ASIN=B0CR3C4GNW,Best watch.. Amoled display is very good.. touch feel is very good.. look is very good like apple watch.. Health sensors are good.. Not showing health numbers on table or on fruits or on other products.. In all other brands I have seen that costlier smart watches also give numbers in heart rate & Oxygen level on fruits & umbrella also.. This watch don’t give numbers other then human body.. Alexa not tested yet.. Color options should be more for ladies.. Want to buy this watch for my wife but she don’t like color options so have to buy other one.. Health parameter wise this watch is best… obviously this is not medical device so u should not rely only on this but compare to all other Nice Firebolt Boat brands - Amazfit is best for health reading.. Bluetooth calling option is not there so who want calling feature should not buy.. Size option should be there in watch… screen size is little small.. Belt is good but harder compare to apple watch..  light weight watch so easily we can wear while sleeping also.. sleep reading is also nice.. water proof so we can wash watch any time we want under tap also..  I have checked personally many other watches of many brands but they were giving health reading on non living items also... Overall satisfied with this watch.. Amzfit must have two options in this model bluetooth calling & without bluetooth calling so people will have choices.. With same features Amazfit should also give size & color options so people will get more choices. And last but not the least - price of this watch 8000/- is little bit higher - so many will not afford this watch & will buy other brands watch so they get big volume of budget oriented customers.. Amazfit should lauch cheapers models also so people will afford to buy Amazfit watches.. Thank you..,[],2022-08-22,46,"Colour: Midnight Black, Style Name: GTS 4 Mini",
3,Not reliable as a fitness tracker,R3TRF7P5HK6V77,https://www.amazon.in/gp/customer-reviews/R3TRF7P5HK6V77/ref=cm_cr_othr_d_rvw_ttl?ie=UTF8&ASIN=B0CR3C4GNW,The watch counted 145 steps while I was sleeping (unless i have sleep walking😃)! Not reliable as a fitness tracker.I will update more on the features later upon testing.,[],2024-08-03,47,"Colour: Midnight Black, Style Name: Active",
4,Good product,R15R6OJWW795YO,https://www.amazon.in/gp/customer-reviews/R15R6OJWW795YO/ref=cm_cr_othr_d_rvw_ttl?ie=UTF8&ASIN=B0CR3C4GNW,"I have been using this watch for the last four months, and it's good. The battery backup is really good. I easily get three days of battery with always on display, sleep-tracking, heart rate monitor every 5mins, twist writs wake and more. I wouldn't say I liked the default wristband; it was really hurting my wrist, and I used to put cotton to avoid getting hurt my wrist until my new band arrived. I also didn't enjoy the menu. I wished it had a more modern-looking menu like Samsung or Apple. And as per the accuracy, I think it's really accurate. Touch is responsive, but sometimes it doesn't respond, and you need to click on the dial, but that is not a huge deal for me. I mainly use this watch to trach my calories and sleep and read notifications.  I have washed clothes and dishes wearing the watch, and it's waterproof; I can confirm that. If you have a little bit more money to spend, you can go for the Samsung Watch 4.",['https://m.media-amazon.com/images/I/61AvPkNTAvL._SY88.jpg'],2023-01-18,48,"Colour: Midnight Black, Style Name: GTS 4 Mini",
4,Does exactly what is promised,R8U6VTGJGET7A,https://www.amazon.in/gp/customer-reviews/R8U6VTGJGET7A/ref=cm_cr_othr_d_rvw_ttl?ie=UTF8&ASIN=B0CR3C4GNW,"Amazfit devices are well known for high-quality AMOLED display and accurate sensors. And the same goes for the gts 4 mini.Pros:Looks decentSlim designLightweightA very good AMOLED displayGreat Battery life even with AODCons:The strap is not very skin friendlyLimited watch faces support (the recent watch update has blocked the custom 3rd party watch faces support)Price is a bit on a higher endThe voice calling feature is not present in the device. And somewhat that is the reason the device is thin and suites on a medium and thin wrist. (recent watches looks and feel bulky on the medium and thin wrist because of more thickness and larger screen size)The device is perfect for people who want a subtle feel watch. Not too fancy, not too classy, instead a balanced watch that looks good all the time.Overall a good value for money if you can get it for or less than 7k. (I purchased it on the launch day)",[],2022-07-26,57,"Colour: Midnight Black, Style Name: GTS 4 Mini",
2,Bluetooth dissconectivity issue,R3NIA9SH2KG38R,https://www.amazon.in/gp/customer-reviews/R3NIA9SH2KG38R/ref=cm_cr_othr_d_rvw_ttl?ie=UTF8&ASIN=B0CR3C4GNW,Watch automatically disconnects from blutooth of phone after sometime.,[],2024-12-05,58,"Colour: Midnight Black, Style Name: Active",
5,Good looking,R1J4SVUPZK08BE,https://www.amazon.in/gp/customer-reviews/R1J4SVUPZK08BE/ref=cm_cr_othr_d_rvw_ttl?ie=UTF8&ASIN=B0CR3C4GNW,Display and sound quality so cute,['https://m.media-amazon.com/images/I/71xLDF4EGkL._SY88.jpg'],2024-10-30,59,"Colour: Midnight Black, Style Name: Active",
5,Value for Money,RN2IAJAT6F3LW,https://www.amazon.in/gp/customer-reviews/RN2IAJAT6F3LW/ref=cm_cr_othr_d_rvw_ttl?ie=UTF8&ASIN=B0CR3C4GNW,Amazing watch. Particularly to track activities. Analysis is good with Zepp for all activities. Bluetooth Connectivity is excellent with phone for notifications.,[],2024-09-27,60,"Colour: Midnight Black, Style Name: Active",
4,Value for Money - Liked it,R14N0FTINEC4HE,https://www.amazon.in/gp/customer-reviews/R14N0FTINEC4HE/ref=cm_cr_othr_d_rvw_ttl?ie=UTF8&ASIN=B0CR3C4GNW,"Built quality & Design - Awesome as per priceCall notification on this watch has a massive lag, sometimes I get call notification on the watch even after I disconnect the call on mobile, which is disgusting.. LOL so this feature is useless on this watch.Not more than 100 watch faces available on the Zepp app, so the Advertisement about 200+ watch faces is fake.I used this type of watch belt for the first time, initially, it was difficult but then I found it more comfortable and decent in looks.Always on Display works well.Navigation is ok as per the watch interface but not perfect - so the Navigation app on this watch is not recommendedThe stocks app is good but customization is not available.Sports modes are still under review so I will update my review after a month once I use all the modes practically.Overall it's a nice watch in this price range. Would recommend it for people with thin hands, it looks decent.","['https://m.media-amazon.com/images/I/414Yml1whaL._SY88.jpg', 'https://m.media-amazon.com/images/I/41T2NcpRaEL._SY88.jpg', 'https://m.media-amazon.com/images/I/41VhxwYIC9L._SY88.jpg', 'https://m.media-amazon.com/images/I/41lKNwefRFL._SY88.jpg', 'https://m.media-amazon.com/images/I/51DbpGXnDJL._SY88.jpg', 'https://m.media-amazon.com/images/I/51qcfG8upaL._SY88.jpg', 'https://m.media-amazon.com/images/I/51wM6DiLqiL._SY88.jpg']",2022-08-23,61,"Colour: Mint Blue, Style Name: GTS 4 Mini",
5,Superb!!,R1G0PYDYPNTDX8,https://www.amazon.in/gp/customer-reviews/R1G0PYDYPNTDX8/ref=cm_cr_othr_d_rvw_ttl?ie=UTF8&ASIN=B0CR3C4GNW,"Purchased this after making a fool of myself by buying crossbeats nexus. I realised good things dont come cheap...coming to this watch this is absolutely a beast at this price point. Some people in reviews are telling that the base price is very high and should wait for sales and all has no idea whats the difference between a cheap one and a costly one.The watch has accurate readings, huges battery life, waterproof, lag less screen, amoled, and tge best part is the app for.mobile...thats so smooth and syncs immediately. If one has budget below 10k and wants a premium product this is the one to go for...",['https://m.media-amazon.com/images/I/61fzrVIdvnL._SY88.jpg'],2024-02-29,62,"Colour: Mint Blue, Style Name: GTS 4 Mini",
5,Battery beast 🔥,RCIJ23S5S5QFE,https://www.amazon.in/gp/customer-reviews/RCIJ23S5S5QFE/ref=cm_cr_othr_d_rvw_ttl?ie=UTF8&ASIN=B0CR3C4GNW,"The media could not be loaded.
                
            
                
            
            
        
    
    








  
  
     I am using for past 3 months and I have charged the watch only three times. I'm using auto heartbeat every 30 mins, used gps when I go for walking (just saying used, not regularly) but not using always on display and  have set screen wake time only 5 sec - as per these I'm still getting 28 days battery life. I bought this watch for the looks but I ended up buying a GOAT product. If u looking for sleek and minimal size this is it. Accuracy  95% ok. Steps are calculated correctly. When u are in a bumpy vehicle the watch is misguided to add steps. But hey.. I've bought this for aesthetic purpose, but it is an amazing all-rounder.","['https://m.media-amazon.com/images/I/61BtFyYG17L._SY88.jpg', 'https://m.media-amazon.com/images/I/61fuvjdAzLL._SY88.jpg', 'https://m.media-amazon.com/images/I/61xU24H6wEL._SY88.jpg']",2024-01-04,63,"Colour: Midnight Black, Style Name: GTS 4 Mini",
5,Best smartwatch under Rs.6000,R14P5UJGK7ZIO2,https://www.amazon.in/gp/customer-reviews/R14P5UJGK7ZIO2/ref=cm_cr_othr_d_rvw_ttl?ie=UTF8&ASIN=B0CR3C4GNW,Amoled display with 14+ days of backup.Useful and fully loaded with features.,[],2024-10-11,64,"Colour: Midnight Black, Style Name: Active",
4,"Durable, functioning well after 2 years",R1AWMVE2L9HWSW,https://www.amazon.in/gp/customer-reviews/R1AWMVE2L9HWSW/ref=cm_cr_othr_d_rvw_ttl?ie=UTF8&ASIN=B0CR3C4GNW,Using this watch since 2 years.Pros:1) excellent battery2)has all the basic fitness related features3) you get notifications of other apps as well.Cons: none so far,[],2024-05-19,49,"Colour: Midnight Black, Style Name: GTS 4 Mini",
5,Best sensors,R2NGC59MSN86S2,https://www.amazon.in/gp/customer-reviews/R2NGC59MSN86S2/ref=cm_cr_othr_d_rvw_ttl?ie=UTF8&ASIN=B0CR3C4GNW,Go for it it has best specs you can get under 10k,[],2024-10-26,50,"Colour: Midnight Black, Style Name: Active",
