ratingScore,reviewTitle,reviewId,reviewUrl,reviewDescription,reviewImages,date,position,variant,totalCategoryRatings
4,Nice watch.,R24ON3CF2YN79M,https://www.amazon.in/gp/customer-reviews/R24ON3CF2YN79M/ref=cm_cr_othr_d_rvw_ttl?ie=UTF8&ASIN=B0CR3C4GNW,"It's been a month that I am using this watch.Pros:Amazing Battery BackupNice DispayGood accuracyCons:No auto brightness feature and Outdoor visibility in sunlight is ok ok, not that great.I don't like zepp apps compare to the Samsung Galaxy wear app.",[],2024-06-15,30,"Colour: Midnight Black, Style Name: Active",
3,Some features are not working or may be updated are missing,R38IIH92BR6BBY,https://www.amazon.in/gp/customer-reviews/R38IIH92BR6BBY/ref=cm_cr_othr_d_rvw_ttl?ie=UTF8&ASIN=B0CR3C4GNW,Proper information is not given,[],2024-10-03,31,"Colour: Midnight Black, Style Name: Active",
5,Amzfit active is awesome,R2FLKQZ1ITQH2Q,https://www.amazon.in/gp/customer-reviews/R2FLKQZ1ITQH2Q/ref=cm_cr_othr_d_rvw_ttl?ie=UTF8&ASIN=B0CR3C4GNW,amzfit active 5 October muje mili mene usko full charge Kiya or kal 26 tak vo 3% charge bachi iska matlab muje 21 din ka batter backup MilaOr sabhi function bahut achhe heHealth reminders is also goodThanks amzfit active,[],2024-10-27,32,"Colour: Midnight Black, Style Name: Active",
5,Perfect Size for small wrist,R26ETGPORECFZD,https://www.amazon.in/gp/customer-reviews/R26ETGPORECFZD/ref=cm_cr_othr_d_rvw_ttl?ie=UTF8&ASIN=B0CR3C4GNW,Nice watch in the price range...i got for 7000. Satisfied with the quality.,[],2025-01-13,17,"Colour: Midnight Black, Style Name: Active",
4,"Accuracy are very good , definately go for it.",R2KD8TV04YANOG,https://www.amazon.in/gp/customer-reviews/R2KD8TV04YANOG/ref=cm_cr_othr_d_rvw_ttl?ie=UTF8&ASIN=B0CR3C4GNW,Size will be very compact & it should be 1.95 instead of 1.75,[],2024-10-29,18,"Colour: Midnight Black, Style Name: Active",
5,Nice product,R2LJRX2LMDPMSA,https://www.amazon.in/gp/customer-reviews/R2LJRX2LMDPMSA/ref=cm_cr_othr_d_rvw_ttl?ie=UTF8&ASIN=B0CR3C4GNW,"Lookative products, use good functional. Best battery backup also","['https://m.media-amazon.com/images/I/61OMPxRSB8L._SY88.jpg', 'https://m.media-amazon.com/images/I/61bAdcdF3hL._SY88.jpg']",2025-01-02,19,"Colour: Midnight Black, Style Name: Active",
4,Good product at this price,R9BVINP5SNW3X,https://www.amazon.in/gp/customer-reviews/R9BVINP5SNW3X/ref=cm_cr_othr_d_rvw_ttl?ie=UTF8&ASIN=B0CR3C4GNW,I loved the watch. Battery backup is awesome. Most of the features are there related to health and sport. Can store music up to 200mb,['https://m.media-amazon.com/images/I/61BeKez9DIL._SY88.jpg'],2024-10-08,20,"Colour: Midnight Black, Style Name: Active",
5,Amazefit active is really an excellent watch to go with in this price point,R34BLXQ6IH5A1B,https://www.amazon.in/gp/customer-reviews/R34BLXQ6IH5A1B/ref=cm_cr_othr_d_rvw_ttl?ie=UTF8&ASIN=B0CR3C4GNW,It is a great product. I was using another amazfit watch for 4 years un fortunately I falls from terrace and damaged but still works then got wet in rain after that it stopped working. I am now very satisfied with this watch as one of its feature is zepp flow which is yet another feature from the previous one which I use alot for make a call or while going for sleep,[],2024-11-30,21,"Colour: Lavender Purple, Style Name: Active",
5,Weight & battery,RLXOSZWDGMNW0,https://www.amazon.in/gp/customer-reviews/RLXOSZWDGMNW0/ref=cm_cr_othr_d_rvw_ttl?ie=UTF8&ASIN=B0CR3C4GNW,"Very good battery life even after use of 21 days still battery is 34%, also watch is light weight.If they add eSIM feature this watch can beat Apple Watch.",[],2024-12-17,22,"Colour: Midnight Black, Style Name: Active",
4,Very good product,R2T1OU563PI4CH,https://www.amazon.in/gp/customer-reviews/R2T1OU563PI4CH/ref=cm_cr_othr_d_rvw_ttl?ie=UTF8&ASIN=B0CR3C4GNW,"ഞാൻ ആഗ്രഹിച്ചതെല്ലാം ഉള്ള ഒരു വാച്ച്, ശരിക്കും smart watch...എല്ലാം കൊണ്ടും നല്ലത്.",[],2024-09-29,23,"Colour: Midnight Black, Style Name: Active",
3,Not made for iPhone users,R7ADL1DB54H6R,https://www.amazon.in/gp/customer-reviews/R7ADL1DB54H6R/ref=cm_cr_othr_d_rvw_ttl?ie=UTF8&ASIN=B0CR3C4GNW,Everything is good app neat n clean the problem is not working all functions with iPhone like calling quick reply n Alexa if u r looking for this features only then don’t buy,['https://m.media-amazon.com/images/I/61BZQy22LKL._SY88.jpg'],2024-10-18,24,"Colour: Midnight Black, Style Name: Active",
4,nice watch but the battery life isn't so great,R1H67CSPIW9UM3,https://www.amazon.in/gp/customer-reviews/R1H67CSPIW9UM3/ref=cm_cr_othr_d_rvw_ttl?ie=UTF8&ASIN=B0CR3C4GNW,Nice watch with a nice screen. Decent activity tracking functions but the battery life isn't too great by Amazfit standards but definitely better battery life than other smart watches.,[],2024-02-28,73,,
1,Worst after sales service,R2FERDVSUJ3P4Y,https://www.amazon.in/gp/customer-reviews/R2FERDVSUJ3P4Y/ref=cm_cr_othr_d_rvw_ttl?ie=UTF8&ASIN=B0CR3C4GNW,My watch has stopped working after 4 months of usage. Their customer care is unresponsive and extremely callous. No idea how to repair the watch,[],2025-01-16,74,"Colour: Midnight Black, Style Name: Active",
4,Almost perfect,R3KPR0WPTY2U9C,https://www.amazon.in/gp/customer-reviews/R3KPR0WPTY2U9C/ref=cm_cr_othr_d_rvw_ttl?ie=UTF8&ASIN=B0CR3C4GNW,Best you can get for 5500 after every discount there is at Amazon sale.Battery is way less then claimed. You can get the battery of 14 days if you just use it for time like a normal watch.Practically it's 5 6 days max.Heart during workout is wrong by good margin.Gps is excellent. However looses signal which is a inherent problem of gps devices.Watch faces are less and at the same time useless. Breathing exercise feature is great.I have bought it recently for 5500 in sale. I still have to find out how it holds up in long run.,['https://m.media-amazon.com/images/I/81qz9g-298L._SY88.jpg'],2022-09-26,75,"Colour: Midnight Black, Style Name: GTS 4 Mini",
5,light weight with big battery,RSS5LSJR2J84E,https://www.amazon.in/gp/customer-reviews/RSS5LSJR2J84E/ref=cm_cr_othr_d_rvw_ttl?ie=UTF8&ASIN=B0CR3C4GNW,very comfortable and light weight with long battery,['https://m.media-amazon.com/images/I/71scht5OoCL._SY88.jpg'],2024-10-09,76,"Colour: Midnight Black, Style Name: Active",
5,A best budget alternative for Apple Watch SE,R22TRWVQ4CM3IA,https://www.amazon.in/gp/customer-reviews/R22TRWVQ4CM3IA/ref=cm_cr_othr_d_rvw_ttl?ie=UTF8&ASIN=B0CR3C4GNW,"For the iPhone users it is one of the best fitness trackers & a budget alternative for Apple Watch SE.Here are the few pros & cons I have noticed so farPros1. Good sleep tracking2. GPS connectivity is good though it takes about 10s to connect & works well only when you are on a open space.3. Has a plenty of workouts to choose from4.  Breath app is good.5. Zepp App is in far with Apple's Fitness App. It sync a few good amount of data with Apple Health. One big issue I had initially was Zepp App doesn't sync Workouts with Health App. But later learned that strava app can help with this issue.6.  Can be linked with Strava to sync the workouts & intern strava can sync the workouts with Apple Health.7. Battery life is decent. After 4 full days of usage with a couple of workouts & walkings with GPS on, current battery % is 42%8. PAI score helps you to motivate to be fit.Cons1. It doesn't have option to track meditation/ mindfulness.2. Zepp app should have an option to sync workout with Apple Health App.3. Stand hours can't be tracked on Zepp App. Available only on the Watch.","['https://m.media-amazon.com/images/I/51NlD6ti-eL._SY88.jpg', 'https://m.media-amazon.com/images/I/51XO2dA0NfL._SY88.jpg']",2022-09-29,77,"Colour: Midnight Black, Style Name: GTS 4 Mini",
4,It does what it says,R2TCGB7STWN4PW,https://www.amazon.in/gp/customer-reviews/R2TCGB7STWN4PW/ref=cm_cr_othr_d_rvw_ttl?ie=UTF8&ASIN=B0CR3C4GNW,"Decent watch. Worth all of Rs. 6999. Only problem is sometimes it doesn't sync the activities with the app, you might need to turn of data/wifi and then try to sync it. Apart from this, great product to its price",[],2023-12-07,78,"Colour: Midnight Black, Style Name: GTS 4 Mini",
5,"Exactly what I needed, An Intelligent watch and an Activity tracker",R26PWJ0654ZFBW,https://www.amazon.in/gp/customer-reviews/R26PWJ0654ZFBW/ref=cm_cr_othr_d_rvw_ttl?ie=UTF8&ASIN=B0CR3C4GNW,"This is exactly what I was looking from a Smart Watch.Small story before we talk about my Amazfit GTS4 mini.I have been using a Chinese Smart watch (Now a days no need to mention term ""Chinese"" as everything is chinese :D ) since couple of years and was frustrated over the battery performance as it could last only upto 3 days on less to moderate use. You use it bit more and Battery is gone within a day. For a watch that I need to charge again and again to even see the time is worth nothing.Then I narrowed down my needs from something smart on my wrist and came to a conclusion to buy AMAZFIT GTS 4 Mini, and it is a wow product.Inbuilt GPS with 5 satellites, great for activity tracking with precision.12 days since full charge, used it moderately to track few of my activities(With GPS) in these 12 days, and battery still shows 33% .Not a fan of receiving the notifications on my Wrist, (something that annoyed me in my last Smart Watch) , so have turned off this feature on GST4 MINI.Also not lazy enough to receive and answer calls on my watch, hence GTS4 Mini not having a feature of receiving a call is not a deal breaker.Good built quality.Perfect Smart companion to go for.",[],2022-08-05,79,"Colour: Midnight Black, Style Name: GTS 4 Mini",
2,Not black in bezels,R32Q2XBUAYHTFB,https://www.amazon.in/gp/customer-reviews/R32Q2XBUAYHTFB/ref=cm_cr_othr_d_rvw_ttl?ie=UTF8&ASIN=B0CR3C4GNW,"Though i ordered midnight black, I received steel bezel model which looks not good at all",[],2024-10-26,80,"Colour: Midnight Black, Style Name: Active",
