ratingScore,reviewTitle,reviewId,reviewUrl,reviewDescription,reviewImages,date,position,variant,totalCategoryRatings
4,What a speaker.... excellent sound clarity,RMNO8TNZGBJQZ,https://www.amazon.in/gp/customer-reviews/RMNO8TNZGBJQZ/ref=cm_cr_othr_d_rvw_ttl?ie=UTF8&ASIN=B078S4P3J9,Sound clarity is best in this price segment. I had tried so many speakers past couple of years but this is the best so far in terms of sound . Speaker is nominal loud not to high or low . Not for someone who is looking for very loud speaker. But it's a chota packet bada dhamaka kinda product.Let's see what happens in long term use,['https://m.media-amazon.com/images/I/61Kbna1ZvUL._SY88.jpg'],2024-12-10,20,Colour: Black,
5,Best under 10K,R2VOUM5KE2DSG1,https://www.amazon.in/gp/customer-reviews/R2VOUM5KE2DSG1/ref=cm_cr_othr_d_rvw_ttl?ie=UTF8&ASIN=B078S4P3J9,"The sharpness in sound and detail is very clear. It's only competitor could be Emebrton which is 4 times as much. For the price, specs and value offered it's a bang for bucks. One of the best affordable speaker below 10K. Worth it.",[],2025-01-27,21,Colour: Blue,
5,What a amazing product,R20AYC1UGKZKYV,https://www.amazon.in/gp/customer-reviews/R20AYC1UGKZKYV/ref=cm_cr_othr_d_rvw_ttl?ie=UTF8&ASIN=B078S4P3J9,"I have been using many speakers but this one has exceeded my expectations. Audio, Treble, Bass on the spot for my requirements. I used it on my desk with volume below 50% and listening since morning till evening, enjoying it.",[],2025-01-22,22,Colour: Black,
5,The Ultimate Portable Speaker for Sound and Durability,R3UKAY47QV9H7E,https://www.amazon.in/gp/customer-reviews/R3UKAY47QV9H7E/ref=cm_cr_othr_d_rvw_ttl?ie=UTF8&ASIN=B078S4P3J9,"The Tribit Xsound Go is a standout portable speaker that impresses with its exceptional sound quality and rugged design. From the moment you hold it, you can feel the solid build and premium materials that promise durability and longevity.",['https://m.media-amazon.com/images/I/71keeCO7CjL._SY88.jpg'],2025-01-22,23,Colour: Black,
5,Best Bluetooth speaker under ₹3000 .,R3KKBUY71B1MS2,https://www.amazon.in/gp/customer-reviews/R3KKBUY71B1MS2/ref=cm_cr_othr_d_rvw_ttl?ie=UTF8&ASIN=B078S4P3J9,Sound bohot achha hei . Ankh Baand karke sunoge toa lagega kei koi bada speaker low sound pei chaal raha hei😌😌. Size kei hisaab sei bohot achha bass and vibration hei . Fully recommend 👌 👌👌👌,[],2025-01-28,24,Colour: Blue,
4,Quality audio 👌,R2L5YPIX2V7XA1,https://www.amazon.in/gp/customer-reviews/R2L5YPIX2V7XA1/ref=cm_cr_othr_d_rvw_ttl?ie=UTF8&ASIN=B078S4P3J9,"The sound clarity of this compact 16 watt speaker is truly impressive, delivering audio notes with remarkable crispness and clarity. While one might not anticipate deep, thumping bass from such a small device, it still manages to provide a noticeable bass presence. Overall, the performance exceeds expectations, despite its diminutive size, the speaker feels robust and well constructed, exuding a sense of quality without feeling excessively heavy.The volume controls and other buttons operate smoothly, and the connectivity is reliable. Additionally, the IPX7 rating ensures water resistance, making it suitable for various environments. With the inclusion of True Wireless Stereo (TWS) capability and the latest Bluetooth 5.3 technology, the design and overall functionality of this speaker are commendable.I still need to evaluate the battery life and charging time, and I will provide an update once that assessment is complete.","['https://m.media-amazon.com/images/I/61Juz22tUWL._SY88.jpg', 'https://m.media-amazon.com/images/I/715gr0v1zKL._SY88.jpg', 'https://m.media-amazon.com/images/I/71FNeWSCUrL._SY88.jpg', 'https://m.media-amazon.com/images/I/71c9qPHG5pL._SY88.jpg', 'https://m.media-amazon.com/images/I/71iMMSnG8xL._SY88.jpg', 'https://m.media-amazon.com/images/I/71vRk5qhiCL._SY88.jpg']",2024-10-23,41,Colour: Black,
5,Amazing product,R3YCSMOETLWTI,https://www.amazon.in/gp/customer-reviews/R3YCSMOETLWTI/ref=cm_cr_othr_d_rvw_ttl?ie=UTF8&ASIN=B078S4P3J9,Amazing sound and battery back up. One of the best product that i have brought online. Unbelievable. ❤️❤️ amazing price. Review after many months of use.,[],2025-01-17,42,Colour: Black,
5,Amazing sound and battery backup in a small package,RO1U7OFUQ7AGE,https://www.amazon.in/gp/customer-reviews/RO1U7OFUQ7AGE/ref=cm_cr_othr_d_rvw_ttl?ie=UTF8&ASIN=B078S4P3J9,"I was skeptical while buying the speaker even after reading so many positive reviews. I understood why people loved this speaker so much. I wanted to buy XSound Plus 2 30W but refrained after reading about issues with connection with laptops. But this 16W speaker impressed me alot.⭕ First thing which I noticed is how small the speaker is. It can fit in your pocket and it almost disappears if you put it in some corner. So Portability wise a big thumbs up. Built quality of the speaker is excellent. Its very heavy and solid for its size. Looks simple and elegant.⭕ Next thing I have noticed the sound quality. I found the bass is tuned towards lower frequency which means you will hear more lower bass than upper bass resulting in no disturbance to the vocals and highs. You will hear the vocals and highs very clearly.⭕ Bluetooth range is amazing. There is no signal loss even if you are listening in an another room with doors closed.⭕ Speaker sounds better in closed rooms and small spaces. If you are using in a big rooms or outdoors it sounds like a normal speaker. You have to try various places in a room before finding the best one for the optimal output and clarity.⭕ This speaker is more suitable for classical music, melodies, instrumentals like guitar, sitar, flute, light percussion. You will enjoy the clarity and instrument separation a lot.⭕ There is no distortion or cracking in the audio even at 100% volume. There is no difference in sound quality at different volume levels. Which is noticeable only in expensive speakers.⭕ Battery backup is very it shines the most. Majority of the brands will be left in the dust in this price range and size when it comes to the battery backup. You don't have to worry about charging multiple times. It will go for a week easily if you listen 3-4 hours a day at 60-80% volume on average.Few negatives which I have observed:❎The flap to open the charging and aux port is very tight and difficult to open if you don't have nails.❎Charging time could have been better. Takes around 3-4 hours for full charge.❎Doesn't sound good even in 15X15 hall also. Strictly good for up-to 12X12 rooms only.❎When you need loud sound with room filling bass it will disappoint you because of the tuning, wattage and size restrictions.❎No App support so you have to rely on your input device's settings.Otherwise its a bang for the buck. Loud music lovers can stay away from this. It best suits for listening to melodious music in calm and peaceful environment and watching movies on laptop.",[],2024-10-04,43,Colour: Black,
4,Amazing,R2D58UTFBAT3SX,https://www.amazon.in/gp/customer-reviews/R2D58UTFBAT3SX/ref=cm_cr_othr_d_rvw_ttl?ie=UTF8&ASIN=B078S4P3J9,"The media could not be loaded.
                
            
                
            
        
    
    








  
  
     have been using since oct , bought at 2399/-punchy bass , crystal clear sound ....worth itat this price......",[],2024-12-24,44,Colour: Black,
5,Big sound in small package,R7UFS6M65EPOQ,https://www.amazon.in/gp/customer-reviews/R7UFS6M65EPOQ/ref=cm_cr_othr_d_rvw_ttl?ie=UTF8&ASIN=B078S4P3J9,"Don't go by the small size of the Tribit, the beats  it produces is awesome.It is value for money. Go for it.",['https://m.media-amazon.com/images/I/71HYWHgEFzL._SY88.jpg'],2025-01-16,45,Colour: Blue,
5,Excellent,R2XXB9OGNTH3GU,https://www.amazon.in/gp/customer-reviews/R2XXB9OGNTH3GU/ref=cm_cr_othr_d_rvw_ttl?ie=UTF8&ASIN=B078S4P3J9,"Very good buy. Clean, clear ,loud music and great battery lasting",[],2025-01-30,46,Colour: Black,
5,Best Speaker,R2ECH6RKDAIYH6,https://www.amazon.in/gp/customer-reviews/R2ECH6RKDAIYH6/ref=cm_cr_othr_d_rvw_ttl?ie=UTF8&ASIN=B078S4P3J9,More than 2 years still just in love with the sound.,['https://m.media-amazon.com/images/I/71tAREkAC7L._SY88.jpg'],2025-01-19,47,Colour: Blue,
5,Good quality,R3VVS171S4TFPI,https://www.amazon.in/gp/customer-reviews/R3VVS171S4TFPI/ref=cm_cr_othr_d_rvw_ttl?ie=UTF8&ASIN=B078S4P3J9,"Works as promised, a good buy in this budget.",[],2025-01-28,48,Colour: Black,
